id,name,text,trans
0000000000000,四音,……ふざけるな。\nこんな結果は、認めない……！,……开什么玩笑。\n这样的结果，我绝不承认……！
0000000000000,四音,審査員の目が狂っている！,评审员的眼睛都瞎了！
0000000000000,燕,結果は結果だ、白草四音。\n受け止めろ。,结果就是结果，白草四音。\n接受现实吧。
0000000000000,燕,お前は私に、負けたのだ。,你已经，输给我了。
0000000000000,四音,ボクは極月学園のエースだぞ！？\nこんなところで、負けるわけない！,我可是极月学园的王牌啊！？\n怎么可能在这种地方输掉！
0000000000000,四音,お前が不正を働いたんだ！,是你耍了卑鄙的手段！
0000000000000,燕,どうやら極月には、お前を説教してやる\n人間がいないようだな！,看来极月那边，没人能好好\n教训教训你啊！
0000000000000,燕,だから私が言ってやる！\n今のままでは、成長できんぞ！,所以就由我来说！\n照你现在这样，是成长不了的！
0000000000000,燕,潔く負けを認めろ！\nそして、自分の現状と向き合え！,给我干脆地承认失败！\n然后，正视你自己的现状！
0000000000000,四音,う、うるさいっ！\nうるさいうるさいっ！！,烦、烦死了！\n吵死了吵死了！！
0000000000000,燕,月花に屈辱を与えたいと、\nそう言っていたな。,你说过想给月花带来屈辱，\n对吧。
0000000000000,四音,それがどうした！？,那又怎么样！？
0000000000000,燕,お前が卑怯なやり方に\nこだわる理由が分かったよ。,我算是明白，你为什么\n执着于那种卑鄙的手段了。
0000000000000,燕,正攻法では月花に勝てないと、\n自覚しているのだろう？,你心里也清楚吧，用堂堂正正的方法\n是赢不了月花的？
0000000000000,四音,――ッ,——！
0000000000000,燕,私には……お前の気持ちが、\n少しは分かるつもりだ。,我……大概能理解，\n你的一些心情。
0000000000000,四音,なんだと……！？,你说什么……！？
0000000000000,燕,私も、十王星南と比べられてきた。\nずっとNo.2だった。,我也一直被人拿来和十王星南比较。\n永远是第二名。
0000000000000,燕,いずれ超えると言い続けてはいたが……\n自分でも、それを信じられなかった。,虽然嘴上总说着总有一天要超越她……\n但连我自己，都无法相信。
0000000000000,燕,邪な考えが、<r\=よぎ>過</r>る時だってあった。,也曾有过，<r\=闪过>邪</r>念的时候。
0000000000000,燕,苦しいよな。\n逃げ出したくなるよな。,很痛苦吧。\n想要逃离吧。
0000000000000,燕,所詮、アイドルなんてただの手段だと、\n言い訳をしたくなるよな。,说什么偶像终究只是手段，\n想要这样找借口吧。
0000000000000,四音,……的外れなことを。\nお前の思い込みでボクを憐れむな！,……一派胡言。\n别用你的臆想来怜悯我！
0000000000000,四音,お前なんかに、お前なんかに……\nボクの気持ちが分かってたまるか！！,像你这种人，像你这种人……\n怎么可能理解我的心情！！
0000000000000,燕,ならば、教えてくれ。\n白草四音。お前の気持ちを。,那么，告诉我吧。\n白草四音。你的心情。
0000000000000,四音,お前に何の関係がある！？,和你有什么关系！？
0000000000000,燕,先輩だからな。,因为我是前辈啊。
0000000000000,四音,違う学校だぞ！,我们学校都不一样！
0000000000000,燕,それでも、この業界では先輩だ。,即便如此，在这个业界我就是前辈。
0000000000000,燕,<em\=>頑張っている</em>後輩に、手を貸したい。\nそれが、そんなに不思議か？,<em\=>对努力着的</em>学妹，我想伸出援手。\n这，有那么不可思议吗？
0000000000000,四音,…………とんだお人好しだ。,…………真是个滥好人。
0000000000000,燕,なぁ、白草四音。,喂，白草四音。
0000000000000,燕,月花に屈辱を与えたいだけなら、\nアイドルにこだわる理由がない。,如果只是为了给月花姐屈辱，\n就没有执着于成为偶像的理由。
0000000000000,燕,お前には、アイドルになった\n理由が他にあるんじゃないのか？,你成为偶像，\n不是还有其他的理由吗？
0000000000000,四音,……………………,……………………
0000000000000,四音,ボクは、ただ……,我只是……
0000000000000,四音,月花姉様と比べられることになっても、\nアイドルになったら、,就算会被拿来和月花姐姐比较，\n只要成为偶像，
0000000000000,四音,誰かが、ボクのことを――,就会有人，把我——
0000000000000,？？？,――お前は自慢の娘だ、月花。\nそうだ、なにかご褒美をあげよう！,——你是我的骄傲，月花。\n对了，给你点什么奖励吧！
0000000000000,？？？,――四音。私は今、忙しい。\n何の用か知らんが、後にしろ。,——四音。我现在很忙。\n不管什么事，之后再说。
0000000000000,月花,――無様だな、四音。,——真是难看啊，四音。
0000000000000,四音,月花、姉様……！？,月花、姐姐……！？
0000000000000,月花,才能を棒に振るだけに留まらず、\n敵に説教されるか。,不仅白白浪费了才能，\n甚至还被敌人教训了一通。
0000000000000,四音,……ぐ、うう……！！,……呜、唔唔……！！
0000000000000,燕,月花、貴様！\n自分の妹に向かって――,月花，你这家伙！\n对自己的妹妹竟然——
0000000000000,月花,ふっ、愚妹などどうでもいい。\n順調に成長しているようだな、燕。,哼，那种蠢妹妹怎样都无所谓。\n看来你成长得很顺利嘛，燕。
0000000000000,月花,その調子で牙を研げ。\n一騎打ち……楽しみにしているぞ。,就照这个势头继续磨砺你的獠牙吧。\n一对一的对决……我可是很期待哦。
0000000000000,燕,くっ……言いたいことだけ言いおって！,咕……想说的话说完就自顾自地走了！
0000000000000,燕,白草四音……大丈夫か？,白草四音……你还好吗？
0000000000000,四音,……あなたに心配される\n筋合いはありません。,……我没有道理\n要让你来担心。
0000000000000,四音,たとえ、あなたでも……\n月花姉様に、勝てるわけがない。,就算是你……\n也不可能赢得了月花姐姐的。
0000000000000,燕,……今の私では、\nやつの心には響かんか。,……以现在的我，\n还无法触动那家伙的心吗。
0000000000000,{user},雨夜さん、お疲れ様です。,雨夜同学，辛苦了。
0000000000000,燕,プロデューサーか。\n『QUARTET』は無事に突破したぞ。,是制作人啊。\n『QUARTET』我们顺利通过了。
0000000000000,{user},ちゃんと見ていましたよ。\n素晴らしいパフォーマンスでした。,我都好好看着呢。\n真是精彩的表演。
0000000000000,{user},ボーカルもダンスもビジュアルも、\nさらに磨きがかかってますね。,歌唱、舞蹈和表现能力，\n全都更加精进了呢。
0000000000000,燕,ここ最近は貴様にライブばかり\nやらされているからな。,最近这段时间，不都是你一直\n让我在进行现场演出嘛。
0000000000000,燕,私自身、手応えは感じている。\nやはり実践が一番の成長になるらしい。,我自己也感觉有成效。\n果然实战才是最好的成长方式。
0000000000000,{user},それは何よりです。,那真是再好不过了。
0000000000000,燕,それに……秦谷とのレッスンも、\nやつから学ばされることは多い。,而且……和秦谷一起训练时，\n从她身上也能学到很多。
0000000000000,燕,悔しいが、教師と生徒というよりは、\n互いに教え合う関係になっている。,虽然不甘心，但与其说是教师与学生，\n更像是互相教导的关系呢。
0000000000000,{user},良い関係を築けているようですね。,看来你们建立了不错的关系呢。
0000000000000,燕,うむ……言葉選びに気を付ける\nようになったおかげだな。,嗯……多亏我变得注意措辞了。
0000000000000,燕,……もしや貴様。,……难道说你这家伙。
0000000000000,燕,その欠点に気づかせるために、\n白草四音の策を止めなかったのか？,是为了让我意识到这个缺点，\n才没有阻止白草四音的计策吗？
0000000000000,{user},この前も説明した通り、\n宣伝に利用できると思っただけですよ。,就像我之前解释过的，\n我只是觉得可以利用来宣传而已。
0000000000000,燕,……どうだかな。\n相変わらず信用ならんやつだ。,……谁知道呢。\n你还是个一如既往不可信的家伙。
0000000000000,燕,だが、まあ……礼は言っておこう。,不过，嘛……还是让我道声谢吧。
info,adv_dear_atbm_016.txt,,
译者,,,
