id,name,text,trans
0000000000000,佑芽,プロデューサーさん！,制作人！
0000000000000,{user},佑芽さん！,佑芽同学！
0000000000000,一同,『Hatsuboshi IDOL FESTIVAL』！,『初星偶像节』！
0000000000000,一同,かいまぁ～～～～～～～～～く！,海马～～～～～～～～～～～！
0000000000000,{user},はっはっはっは！　\nいや～、テンション上がりますね！,哈哈哈哈哈！\n哎呀～，情绪高涨起来啦！
0000000000000,佑芽,ふふふ～、今日のプロデューサーさん、,呼呼呼～，今天的制作人，
0000000000000,佑芽,あたしに負けないくらい、\nはしゃいでますね♪,简直和我一样，\n兴奋得不得了嘛♪
0000000000000,{user},あたりまえじゃないですか。\nなんといっても今日は――,这不是理所当然的吗。\n不管怎么说今天可是——
0000000000000,{user},花海佑芽が学園一のアイドル、\n<r\=プリマステラ>『一番星』</r>になる日なんですから！,花海佑芽成为学园第一偶像、\n<r\=プリマステラ>『一等星』</r>的日子啊！
0000000000000,佑芽,それだけじゃありませんよ！　\n『H.I.F』は――,还不止如此哦！\n『H.I.F』是——
0000000000000,佑芽,素敵な初星アイドルたちが、最高の\nライブを魅せてくれるお祭りなんです！,优秀的初星偶像们，为我们展现最棒的\n演出的庆典啊！
0000000000000,{user},ははっ、最近の佑芽さんは……\nどんどん。,哈哈，最近的佑芽同学……\n越来越。
0000000000000,{user},アイドルのことが\n好きになってきているようですね。,对偶像的事情\n越来越喜欢了呢。
0000000000000,佑芽,はいッ！　どんどんどんどんどんどん\n大好きになってきてます！,是的！越来越越来越越来越越来越\n超级喜欢了！
0000000000000,佑芽,なんたって、あたしの夢は――,毕竟啊，我的梦想是——
0000000000000,佑芽,トップアイドルですから！,成为顶级偶像啊！
0000000000000,佑芽,アイドルのことなら、\nなんでもしりたくなっちゃうんです。,只要是关于偶像的事情，\n我就什么都想知道。
0000000000000,佑芽,今度はあたしが……,这次轮到我……
0000000000000,佑芽,『お姉ちゃんの目標になる』って、\n誓いましたから。,要『成为姐姐的目标』，\n我发过誓了。
0000000000000,{user},（佑芽さんの眼に、炎がともっている）,（佑芽同学的眼中，燃起了火焰）
0000000000000,{user},（その原因は――）,（其原因在于——）
0000000000000,咲季,『H.I.F』がはじまるギリギリまで、\n実家に帰って猛特訓するのよ――,直到『H.I.F』即将开始的最后一刻，\n我都要回老家进行魔鬼特训哦——
0000000000000,咲季,この新しい仲間たちと一緒にね！,和这些新伙伴们一起呢！
0000000000000,佑芽,星南先輩と、燐羽ちゃんと、\nお姉ちゃん。,和星南学姐、小燐羽，\n还有姐姐一起。
0000000000000,佑芽,どんな特訓をしてきたんだろう！　\nどんなライブを見せてくれるんだろう！,到底进行了怎样的特训呢！\n又会为我们呈现怎样的演出呢！
0000000000000,佑芽,わくわくが止まりませ～～～～～ん！,我的期待之情已经无法抑制啦～～～～～！
0000000000000,{user},俺もです。我々はついに……\n咲季さんに<em\=>勝ってしまった</em>――,我也是。我们终于……\n<em>战胜了</em>咲季同学——
0000000000000,{user},その結果を、\nこれから体感することになります。,而这个结果，\n接下来我们将亲身体验。
0000000000000,{user},楽しみですね！！！！,真是令人期待！！！！
0000000000000,佑芽,はいっ！！,是的！！
0000000000000,{user},今日は、咲季さんがいない期間、\n『お世話になった皆さん』も、\n客席で見守ってくれていますよ。,今天，在咲季同学缺席的这段时间里，\n那些『承蒙关照的各位』\n也都在观众席上守望着我们哦。
0000000000000,佑芽,お母さんと……スタッフの皆さん。,妈妈……还有各位工作人员。
0000000000000,佑芽,食事とか、カラダのケアとか、\n助かりましたけど……,饮食啊、身体护理啊，\n确实多亏了大家帮忙……
0000000000000,佑芽,お母さんのマッサージって、\n痛いんですよねー。力強いから。,不过妈妈的按摩，\n真的有点痛呢。因为力道很大。
0000000000000,{user},……佑芽さんは、\nお母さん似だと思います。,……我觉得佑芽同学，\n和妈妈很像呢。
0000000000000,佑芽,え～、あたしあんな乱暴じゃない～。,诶～，我才没那么粗鲁啦～。
0000000000000,{user},アイドルトレーナーとしても\n優秀な方です。,她作为偶像训练师\n也是非常优秀的。
0000000000000,佑芽,得意げに言ってました。,她很自豪地这么说过。
0000000000000,佑芽,あたしたちがアイドルを目指したから、\n急いで勉強をはじめたんだよって……,她说因为我们立志成为偶像，\n她才急急忙忙开始学习的……
0000000000000,佑芽,いま取れる資格は全部取ったぞ～、\nって自慢されました。,还跟我炫耀说，现在能考的资格证\n她可是全都考到手了哦～。
0000000000000,佑芽,学園長からスタッフを紹介して\nもらったりしてて、,我们请校长介绍了工作人员\n之类的，
0000000000000,佑芽,アイドルのトレーニング施設も\n作っちゃったって。,还建造了偶像的训练设施。
0000000000000,{user},俺も一枚かんでますよ。,我也参与其中了哦。
0000000000000,佑芽,らしいですね！,好像是呢！
0000000000000,{user},正式オープンしたら佑芽さんと一緒に\n行こうと計画していたのですが。,本来计划等正式开放后\n和佑芽同学一起去的。
0000000000000,佑芽,今回はお姉ちゃんたちに\n先を越されちゃいましたねー。,这次被姐姐们\n抢先一步了呢。
0000000000000,{user},最新施設での特訓成果は、\nすぐに見せていただけるでしょう。,在最新设施里的特训成果，\n马上就能让我们见识到了吧。
0000000000000,佑芽,あたしたちだって、\nできることはぜんぶやりました。,我们也是，\n能做的事都全力以赴了。
0000000000000,佑芽,厳しい特訓ならこっちだって\nたっぷりしてきているんです！　\n――負けませんよッ！,要说严苛的特训我们这边\n也是做足了准备的！\n——可不会输哦！
0000000000000,{user},ふむ……,嗯……
0000000000000,佑芽,あの……プロデューサーさん？　\nあたしの顔に、なにかついてます？,那个……制作人？\n我的脸上，沾了什么东西吗？
0000000000000,{user},いまの佑芽さんは、\nかつて目指した理想に、\n大きく近づいています。,现在的佑芽同学，\n正大幅接近曾经\n追求的理想。
0000000000000,佑芽,えっと……それって、アレでしょうか。\n最高の歌唱力、最高のダンス。,呃……那个，是指那个吗。\n最强的歌唱力，最强的舞蹈。
0000000000000,佑芽,最高の……び、美貌で……,最强的……美、美貌……
0000000000000,{user},――勝つべくして勝つ。,——为胜利而胜。
0000000000000,佑芽,常勝不敗の……トップアイドル。,常胜不败的……顶级偶像。
0000000000000,佑芽,あたし……近づいて……ますか？,我……接近了吗？
0000000000000,{user},驚くほどの早さですよ。,速度快得惊人哦。
0000000000000,{user},いまの佑芽さんなら、たとえ十王星南\nだろうと……咲季さんにだって！,如果是现在的佑芽同学，即便是十王星南\n……哪怕是咲季同学也！
0000000000000,{user},この圧倒的な数値……\n負けるわけがないッ！！,这压倒性的数值……\n怎么可能输啊！！
0000000000000,佑芽,こうじゃないんだよなぁ～～～～。\n方向性が違うんだよなぁ～～～～。,这样不对啦～～～～。\n方向性完全错了啦～～～～。
0000000000000,佑芽,んも～、プロデューサーさんってぇ。,真是的～，制作人同学你啊。
0000000000000,佑芽,あたしのこと、\nすっごくわかってくれてて……,明明把我的事情……\n都了解得那么透彻……
0000000000000,佑芽,いつも的確な判断をしてくれるのに……,平时总能做出准确的判断……
0000000000000,佑芽,肝心なときに欲しい言葉を\nくれないんですよね～。,却在关键时候不肯说出\n我想要听的话呢～。
0000000000000,{user},本番前なので、\n力強く本音を口にしたんですが……,因为马上就要正式演出了，\n所以我才鼓起勇气说出了真心话……
0000000000000,佑芽,ぶ～っ、だめでーす。\nやり直しを要求しまーす！！,噗～，不行不行！\n我要求重来一遍！！
0000000000000,{user},佑芽さんは、咲季さんに勝って――\nようやく本当の意味で……\nアイドルになりました。,佑芽同学，在战胜咲季同学之后——\n终于从真正的意义上……\n成为了一名偶像。
0000000000000,{user},アイドルとしての心・技・体が\n揃ったんです。,偶像所需的心、技、体\n已经全部集齐了。
0000000000000,{user},断言します。いまのあなたに、\n魅了できないものはない。,我断言。现在的你，\n没有什么是无法魅惑的。
0000000000000,佑芽,――――――――――――――――――,——————————————————
0000000000000,佑芽,方向性はバッチリなんですけど、\n照れちゃうのでもうちょっと弱めに……,方向性是完美无缺啦，\n但这样太让人害羞了所以再稍微柔和一点……
0000000000000,佑芽,ああっ、笑わないでくださいよぉ～！,啊～，请不要笑啦～！
0000000000000,佑芽,ううぅぅ～～～～！　\nプロデューサーさんめぇ……,呜呜呜～～～～！\n制作人同学你坏……
0000000000000,{user},どうか許してください。,请您务必原谅我。
0000000000000,{user},あなたのプロデュースをしていると、\nずっと楽しいんですから。,因为接受您的培育时，\n我一直都感到非常快乐。
0000000000000,佑芽,じゃあ許します。あたしもなので！,那我就原谅你啦。因为我也一样！
0000000000000,{user},本番前に機嫌が直ってよかった。,能在正式演出前和好真是太好了。
0000000000000,{user},さあ、ブレイクスルーを果たした、\n花海佑芽の初陣です。,来吧，这就是实现了突破的、\n花海佑芽的初次登台。
select,,全員すり潰してやりましょう！,让我们把所有人都碾碎吧！
0000000000000,佑芽,はいっ！　\nお任せくださいプロデューサーさん！,好的！\n请交给我吧，制作人同学！
0000000000000,佑芽,花海佑芽！　\n全力で皆さんにぶつかってきます！,花海佑芽！\n我会全力以赴地为大家献上表演！
info,adv_dear_hume_021.txt,,
译者,,,
