id,name,text,trans
0000000000000,清夏,きた～く！,来啦～！
0000000000000,リーリヤ,ふふ、おかえりなさい。,呵呵，欢迎回来。
0000000000000,清夏,ただいま！\nリーリヤも、おかえり！,我回来了！\n莉莉娅也欢迎回来！
0000000000000,リーリヤ,えっと、ただいま？,那个…我回来了？
0000000000000,清夏,へへっ、やっぱりおうちが一番\n落ち着くね～♪,嘿嘿～果然还是家里最让人\n安心呢～♪
0000000000000,リーリヤ,まだ、1年も経ってないのにね。,明明还不到一年呢。
0000000000000,清夏,なんだか、ずっと一緒にいるみたいな\n感じがするよね～。,总觉得好像已经\n在一起生活很久了呢～
0000000000000,リーリヤ,あ、そうだ清夏ちゃん。\n確か、宿題あったよね？,啊，对了清夏ちゃん\n我记得有作业要写吧？
0000000000000,清夏,あ～、雑誌からのアンケートだっけ？\nやっとかないとね～。,啊～是杂志的问卷调查吧？\n得赶紧完成才行呢～
0000000000000,リーリヤ,好きな食べ物、趣味、特技……\nうん、普通のアンケートだね。,喜欢的食物、兴趣、特长…\n嗯，很普通的问卷呢。
0000000000000,リーリヤ,でも、こういうのが人気のきっかけに\nなるから、頑張らないと……！,但是这种问卷可能会成为受欢迎的契机\n所以必须加油……！
0000000000000,清夏,肩の力抜いて、素直に答えた方が\nいいんじゃない？,不用太紧张，坦诚回答\n不是更好吗？
0000000000000,清夏,あ、「仲の良い友達は？」って\n項目あるよ！　葛城リーリヤっと……,啊，这里有「关系好的朋友是？」\n这一项呢！葛城莉莉娅和……
0000000000000,リーリヤ,じゃあわたしも、清夏ちゃんって\n書いちゃおうかな……えへへ……。,那我也要写上清夏ちゃん的名字…\n嘿嘿……
0000000000000,清夏,え～っと、次の項目は……\n「その友達の好きなところ」だって。,嗯～下一项是…\n「喜欢那个朋友的什么地方」。
0000000000000,リーリヤ,ほ、ほんとだ。\nいっぱいあって、難しいなぁ……。,真、真的呢\n优点太多反而不知道怎么写好了……
0000000000000,清夏,あたしも、いっぱいありすぎて\n紙に収まる気がしないよ～！,我也是优点多到\n感觉一张纸都写不下呢～！
0000000000000,リーリヤ,そ、そうなの？\n…………たとえば？,是、是吗？\n……比如说？
0000000000000,清夏,好きなものの話をしてる時、\n目がきらきらしてるところとか～。,在聊喜欢的东西时\n眼睛闪闪发光的样子啦～
0000000000000,リーリヤ,きらきら、してるのかな……？,我…真的有在闪闪发光吗……？
0000000000000,清夏,アニメの台詞を引用してる時、\nドヤ顔で可愛いところとか～。,引用动画台词的时候，\n会露出得意表情的可爱之处之类的～。
0000000000000,リーリヤ,そ、そんな顔してないよ！,才、才没有摆出那种表情呢！
0000000000000,清夏,心が強くて、一度決めたことは\n絶対に曲げないところとか……,内心坚强，一旦决定的事就\n绝对不会退让的地方……
0000000000000,リーリヤ,…………そうなのかな？,…………是这样吗？
0000000000000,清夏,いつだって、あたしのことを、\n信じてくれるところとか……,无论何时都会\n相信我的地方……
0000000000000,リーリヤ,……当たり前、だよ。,……这是理所当然的啊。
0000000000000,清夏,……そーゆーリーリヤも、\nいっぱい、あるんでしょ？,……这样的莉莉娅\n不也有很多优点吗？
0000000000000,リーリヤ,えっと、コスメとかファッションの話を\nしてる時、楽しそうなところとか……,那个，聊化妆品和时尚话题时\n显得很开心的样子……
0000000000000,清夏,まあ、好きだからね～。,嘛，因为很喜欢嘛～。
0000000000000,リーリヤ,明るく元気に振る舞いながら、\nみんなに気を遣ってるところとか……,虽然表现得开朗活泼，\n但其实处处为大家着想的地方……
0000000000000,清夏,ま、まあ、一応ね？,嘛、嘛啊，算是吧？
0000000000000,リーリヤ,おちゃらけたふりしてるけど、\n実は繊細で、真面目なところとか……,虽然总爱装出轻浮的样子，\n其实既细腻又认真的地方……
0000000000000,清夏,…………そんなことない、ケド。,…………才没有那回事呢。
0000000000000,リーリヤ,いつもわたしの手を引っ張って、\n知らない世界を見せてくれるところ。,总是牵着我的手，\n带我见识未知世界的地方。
0000000000000,清夏,…………そ、そっか。,…………这、这样啊。
0000000000000,リーリヤ,……………………,……………………
0000000000000,清夏,……………………,……………………
0000000000000,リーリヤ,しゅ、宿題進めよっか！,作、作业该继续推进了吧！
0000000000000,清夏,そ、そうだね！,说、说得对呢！
0000000000000,リーリヤ,えーっと、後は、この質問に答える\nだけで終わりかな……？,呃—，接下来只要回答完\n这个问题就结束了吧……？
0000000000000,清夏,宿題、飽きちゃったよリーリヤ～。\n構ってよ～。,作业做腻了啦莉莉娅～。\n陪人家玩嘛～。
0000000000000,リーリヤ,も～、集中できない！,真是的～，都没法集中注意力了！
0000000000000,清夏,わっ、リーリヤが怒った！？,哇，莉莉娅生气了吗！？
0000000000000,リーリヤ,悪い子の清夏ちゃんは、\nこちょこちょの刑だよ……！,坏孩子清夏要接受\n挠痒痒之刑哦……！
0000000000000,清夏,ええっ！？\nちょ、それは――,诶！？\n等、等一下——
0000000000000,清夏,あはははははは！\nく、くすぐったいよリーリヤ！,啊哈哈哈哈哈哈！\n好、好痒啊莉莉娅！
0000000000000,リーリヤ,反省した？,知道错了吗？
0000000000000,清夏,は、反省したよ！\n宿題の続きやるから、許して？,知、知道错了！\n我这就继续写作业，饶了我吧？
0000000000000,リーリヤ,最後の質問は……「もしアイドルじゃ\nなかった時の将来の夢」、だって。,最后的问题是……如果没有成为偶像\n时的未来梦想，上面这么写着。
0000000000000,清夏,アイドル以外の夢、かぁ……,偶像之外的梦想吗……
0000000000000,清夏,……リーリヤは、もしアイドルに\nなれなかったら、どうするの？,……莉莉娅要是没能\n成为偶像的话，会怎么做呢？
0000000000000,リーリヤ,考えたこと、ないけど……\nそういう夢を見たことはあるよ。,虽然没考虑过……\n但倒是做过这样的梦呢。
0000000000000,リーリヤ,初星学園を卒業しても、\nアイドルになれなかったわたしは……,即使从初星学园毕业，\n也没能成为偶像的我……
0000000000000,リーリヤ,日本に留まって、アニメやマンガを\n世界に広める翻訳の仕事をするんだ。,会留在日本，从事将动漫和漫画\n推广到世界的翻译工作。
0000000000000,清夏,……翻訳、かぁ。\n確かに、リーリヤならできそうだね。,……翻译啊。\n确实，感觉莉莉娅很适合呢。
0000000000000,リーリヤ,昔アイドルを目指してたことは、\nいつの間にか笑い話になって……,曾经以偶像为目标这件事，\n不知何时变成了笑谈……
0000000000000,リーリヤ,でも、ふとテレビを点けた時、\nそこには清夏ちゃんがいたんだ。,但是，偶尔打开电视时，\n却看到清夏出现在屏幕上。
0000000000000,リーリヤ,咲季ちゃん、手毬ちゃん、ことねちゃん\nと一緒に、トークしてて……,和咲季、手毬、琴音\n一起进行谈话节目……
0000000000000,リーリヤ,この4人は全員同じクラスだった、\nみたいな紹介をされてて……,主持人介绍说这四个人\n好像曾经都是同班同学……
0000000000000,リーリヤ,――その中に、わたしはいない。,——而其中，并没有我的身影。
0000000000000,リーリヤ,夢はいつも、そこで終わるんだ。,梦想总是在那里终结。
0000000000000,清夏,……………………,……………………
0000000000000,清夏,あたしも……そういう夢、\n見たことあるよ。,我也……做过那样的梦。
0000000000000,リーリヤ,清夏ちゃんも？,清夏也做过吗？
0000000000000,清夏,うん。,嗯。
0000000000000,清夏,結局、ちゃんと踊ることができないまま\n学校を卒業することになって……,最终直到毕业都没能好好跳舞，\n就这样离开了学校……
0000000000000,清夏,アイドルを諦めて、裏方に回るんだ。\nメイクアップアーティストになるの。,放弃当偶像，转做幕后工作。\n成为化妆师。
0000000000000,清夏,アイドルたちをサポートするお仕事も、\n結構楽しくて、やりがいがあって……,支持偶像们的工作，\n其实也很快乐，很有意义……
0000000000000,清夏,そこで、リーリヤと再会するんだ。\nリーリヤは人気アイドルになってて……,在那里，与莉莉娅重逢了。\n莉莉娅成了人气偶像……
0000000000000,清夏,リーリヤにメイクしながら、\nあの頃は楽しかったねって話をして、,一边给莉莉娅化妆，\n一边聊着那时候真开心啊，
0000000000000,清夏,約束なんてなかったみたいに、\nあたしたちは振舞うんだ。,就像从没有过约定似的，\n我们这样相处着。
0000000000000,リーリヤ,……大丈夫だよ、清夏ちゃん。,……没关系的，清夏。
0000000000000,リーリヤ,もしかしたら、そういう未来だって、\nあるのかもしれないけど、,或许确实可能存在，\n那样的未来，
0000000000000,リーリヤ,今ここにいるわたしたちは、違う。\nそういう未来を選ばない。,但此刻在这里的我们不同。\n不会选择那样的未来。
0000000000000,リーリヤ,絶対に、アイドルになろう。,一定要成为偶像。
0000000000000,清夏,もちろん。\nふたりとも、ね？,当然。\n我们两个都是，对吧？
info,adv_event_020_main-05.txt,,
译者,,,
